{
  "id": "architecture-decision",
  "extends": "base",
  "rejectionRouting": {
    "analyze": "analyze",
    "design": "design",
    "review": "design"
  },
  "overrides": {
    "removeSteps": ["implement", "qa"],
    "steps": {
      "design": { "role": "architect" },
      "review": { "role": "reviewer" }
    }
  }
}
